Text,Category
"Собрали идеи с заботой о самом близком человеке. Лучший подарок для мамы — ваша забота, которую вполне достойно выразит устройство для массажа шеи, плеч, спины и ног. Пусть у родного человека будет возможность отдохнуть и расслабиться после тяжёлого дня! А отдохнувшая мама — счастливая мама. Кажется, идеальный плед должен быть именно таким, как на картинке, — большим, красивым и тёплым. С разноцветными флисовыми тряпочками, которые продаются в некоторых магазинах, его неловко даже сравнивать. Так что обратите внимание на варианты ниже. Подарок не из дешёвых, но зато маме не придётся тратить все выходные на уборку. Пусть этим занимается умная техника! Роботу всё равно, что чистить: он справится и с твёрдым покрытием, и с изрядно запылившимся ковром. Приятное на ощупь банное полотенце высокого качества — отличный подарок для практичной мамы. В некоторых магазинах можно найти наборы с фигурным мылом в комплекте. Большой, тёплый и очень мягкий, чтобы завернуться в него полностью и будто погрузиться в объятия после расслабляющего душа. Она наверняка ещё долго будет вам благодарна. Кофемашина скрасит даже самое ненастное утро. Подобрать подходящую по бюджету модель не составит труда: есть простые капельные кофеварки без дополнительных функций, рожковые с механическим капучинатором, капсульные варианты. Самая дорогостоящая, но при этом и наиболее простая в использовании — модель с автоматическим капучинатором и встроенной ёмкостью для молока. Настоящий домашний помощник разбудит утром, напомнит о важных делах, расскажет о ситуации на дорогах, включит музыку, подкаст или аудиокнигу, поддержит любой разговор, поможет управлять техникой в доме. И это далеко не полный список того, что умеет умная колонка. Если ваша избранница любит экспериментировать со своим образом, но щипцов для укладки у неё до сих пор нет, пришла пора это исправить. С таким прибором волосы можно как завивать, так и выпрямлять, укладывать, создавать объём. Практичной женщине пригодится светильник, дополненный полезными функциями. Например, встроенной беспроводной зарядкой, будильником или генератором белого шума. Любительницы милых вещиц можно презентовать лампу с пластиной для записей, чтобы оставлять на ней послания. Или же рассмотреть в качестве подарка просто забавную модель в виде утки — не прогадаете. Выбирайте приятный на ощупь и при этом симпатичный комплект, чтобы каждый день дома был наполнен уютом и комфортом. Лучше отдать предпочтение моделям свободного кроя, которые не сковывают движений. Вещицы, которые помогут выразить свою любовь. Подарок, которым, скорее всего, получится воспользоваться сразу же после вручения. Один дарить точно не стоит, даже если сестра и живёт одна. Лучше присмотреться к наборам минимум из двух изделий на тонких изящных ножках. В пушистых тапочках ногам будет тепло, даже если полы в доме не застелены коврами. В подарок можно выбрать модель с забавным дизайном для поднятия настроения или же элегантную пару. Очень полезная вещь для всех работающих девушек. Помимо основного отсека для ноутбука, в некоторых моделях есть также карманы для периферии вроде мышки и зарядного устройства. А ещё — крепление на ручку чемодана. Благодаря этому будет удобно брать с собой технику куда угодно. Этот презент гарантированно не останется без внимания. Во‑первых, зонт сам по себе вещь нужная. Во‑вторых, такая красота просто не может не впечатлить, если выбирать модели с красочными принтами, которые добавят яркости хмурому дню. Когда говорят, что ничего не нужно, но с пустыми руками идти в гости неудобно, — выбирайте набор носков. Вещь универсальная, нужна всем и всегда. Так пусть благодаря вам у сестры будет стратегический запас милых носочков! Универсальные идеи для девочек разных возрастов. Если вашей дочери от 7 до 10 лет и она увлекается рукоделием, такой набор наверняка приведёт её в восторг. Представьте, сколько браслетов и бус можно сделать с его помощью! Уверены, такими украшениями в итоге будут одарены все близкие дочери люди. Дочке помладше подойдут заколки с бантами, пушистыми деталями, резинки со смешными мордашками и другими интересными украшениями. Девушке постарше — более утончённые аксессуары с камнями, бархатными вставками, объёмные резинки для пучков. Рисовать можно прямо на экране с помощью стилуса, а затем стирать изображения нажатием всего одной кнопки — удобно и не нужно покупать множество альбомов и скетчбуков. Энергопотребление в таких устройствах совсем небольшое, заряда хватает в среднем на месяц. Чтобы не приходилось нервничать из‑за того, что у дочки снова разрядился смартфон, подарите ей внешний аккумулятор. Весит он немного, поэтому его без проблем можно брать с собой куда угодно. Ребёнок рад, а вы спокойны: теперь дочь всегда будет на связи. Отличный подарок для юных художниц. Писать акварелью поначалу бывает сложно: тонкие детали расплываются, а цвета самопроизвольно перемешиваются между собой. Акварельные карандаши же — неплохой промежуточный вариант, с помощью которого можно освоить новую технику рисования. Выведенную ими линию можно запросто размыть водой и сделать оттенок прозрачнее. То, что порадует и пригодится на рабочем месте. Прекрасный выход из ситуации, когда понятия не имеешь, что дарить. Вкусный и тонизирующий чай любят практически все, так что это простое и универсальное решение. Если же вы не уверены, что выбранный вами чай придётся коллеге по вкусу, дарите кружку. Приятный бонус — оригинальный дизайн или забавная надпись. Плитка бельгийского шоколада ручной работы с добавлением орехов, фруктов и ягод прекрасно дополнит презенты из предыдущих списков или станет самостоятельным знаком внимания. Если уверены, что коллега поймёт вас правильно, можете презентовать набор сладостей в упаковке со смешными надписями. Или же пойти оригинальным путём и подарить шоколад в виде пельменей. Аксессуар снизит напряжение в ногах, спасёт от отёков и появления варикоза. Если коллега проводит много времени, сидя за рабочим столом, то наверняка оценит подставку по достоинству и ещё не один раз поблагодарит вас. Подобную игрушку стоит вручать с пожеланием крепких нервов сегодня и всегда. Рассмотрите сквиши — модели из материала, который быстро восстанавливается после смятия. Или подушки с особым наполнением, благодаря которым изделия так приятно сжимать. Косметика, одежда, набор для творчества и кое‑что пикантное, что наверняка порадует близкую подругу. Набор колец, красивые или забавные серьги, подвеска или даже брошь — выбирайте исходя из стиля и предпочтений подруги, чтобы точно не прогадать. Если вы знаете тип кожи подруги и её любимого производителя косметики, так что выбрать что‑то подходящее не составит труда. Другой вариант — подсмотреть, какие тюбики и баночки стоят у неё в ванной, чтобы не ошибиться с выбором. Если же такой возможности нет, можно выбрать подходящий вариант в интернет‑магазине по отзывам или отправиться в офлайн‑магазин и проконсультироваться с продавцами. Ну а самый простой и при этом надёжный вариант — довериться нам и купить что‑то по ссылкам ниже. Без лишних слов: подруга будет благодарна за игрушку из качественного материала, способную работать в разных режимах. Пользоваться устройством можно и соло, и в паре с партнёром — универсальная вещица, которая подарит много новых ощущений. Уютная оверсайз‑модель базового цвета впишется в гардероб подруги, предпочитающей удобство. Также можно выбрать вариант со смелым, ярким или просто забавным принтом, если уверены, что такой подарок будет воспринят и оценён по достоинству. Картина по номерам, алмазная мозаика, набор для вышивки, варки мыла, создания свечей, работы с алкогольными чернилами или эпоксидной смолой — чего сейчас только не найти! Творческая личность наверняка оценит презент и с удовольствием окунётся в процесс создания шедевра. ",error
"Telegram начал предлагать небольшому количеству пользователей поучаствовать в Peer-to-Peer Login Program («Программа одноранговой авторизации»). В её рамках пользователь разрешает мессенджеру отправлять со своего номера коды авторизации другим пользователям — в обмен на подписку Premium. Редакторы телеграм-канала Telegram Info сообщают, что первыми такие предложения начали получать пользователи из стран с дорогими тарифами на связь — например, из Индонезии. Им удалось получить подтверждающие скриншоты от подписчика из этой страны. Судя по тексту поста и скриншотам, для получения месяца подписки Premium нужно отправить 150 SMS. Если включить опцию «Отправлять SMS за пределы моей страны», потребуется только 100 сообщений, но точное количество может зависеть от региона. Никакие расходы на рассылку сообщений Telegram не компенсирует — только даёт код на подписку после отправки нужного количества SMS. Опция пока доступна только на Android. Появится ли она на iOS и будет ли доступна для пользователей из России, неизвестно. ",error
"Внешний аккумулятор QOOVI ёмкостью 60 000 мА·ч поддерживает быструю зарядку по стандартам PD и QC 3.0 на мощности до 22,5 Вт. Размер модели: 14,5 × 7,5 × 7 см. Вес — 1,2 кг. Брать пауэрбанк в походы налегке вряд ли получится, но для длительного отдыха на природе гаджет окажется в самый раз. Для подключения устройств предусмотрено четыре выходных порта USB‑A и пара USB‑C, работающих в обоих направлениях. В темноте пригодится встроенный фонарик, способный непрерывно работать до 48 часов. Отслеживать уровень заряда в процентах поможет крупный светодиодный дисплей. Полностью аккумулятор подпитывается примерно за 12 часов. В отзывах покупатели хвалят пауэрбанк за полное соответствие заявленным характеристикам. Цена: 7 977 → 3 875 рублей с купоном продавца. Обратите внимание: все цены действительны на момент публикации. Магазины могут обновлять стоимость товаров в течение дня. ",error
